{
  "$schema": "https://raw.githubusercontent.com/wasi-master/wmkeyboard-addon-repository/main/docs/addons/wmkeyboard-repo.schema.json",
  "format": "wmkeyboard-repo",
  "version": 1,
  "repo": {
    "id": "com.wasimaster.wmkeyboard.official",
    "name": "WM Keyboard Official Addons",
    "description": "Example addon repository: one payload of every type — theme, layout, dictionary, snippets, stickers, icon packs, fonts and key sounds. Fork it to make your own.",
    "author": "Wasi Master",
    "homepage": "https://github.com/wasi-master/wmkeyboard-addon-repository",
    "icon": "icon.png",
    "updatedAt": "2026-08-09"
  },
  "addons": [
    {
      "id": "arcade-cabinet",
      "type": "theme",
      "name": "Arcade Cabinet",
      "version": "1.0.0",
      "author": "Wasi Master",
      "description": "A CRT arcade board: pixel-grid key textures, a slow neon hue sweep, WASD picked out in cyan, and pixel coins, stars and hearts bursting under every press. Designed around the Press Start 2P font and the Blip key sound.",
      "tags": [
        "retro",
        "arcade",
        "pixel",
        "neon",
        "dark",
        "effects"
      ],
      "path": "themes/arcade-cabinet.wmtheme.json",
      "sha256": "e7bbbe55e564e90d6e99da6177b75f1e215ec22a5557b189d2e2f0ac3c91639e",
      "sizeBytes": 3389,
      "previews": [
        "previews/arcade-cabinet.jpg"
      ],
      "minAppVersion": 3,
      "license": "CC0-1.0",
      "requires": [
        "press-start-2p",
        "blip"
      ]
    },
    {
      "id": "sakura-breeze",
      "type": "theme",
      "name": "Sakura Breeze",
      "version": "1.1.0",
      "author": "Wasi Master",
      "description": "A light spring theme: scalloped white keys over a flowing pink sky, a blossom branch leaning across the board, drifting petal stickers and blossom emoji bursting on each press. Designed around the Caveat font and the Marimba key sound.",
      "tags": [
        "light",
        "pink",
        "flowers",
        "stickers",
        "effects"
      ],
      "path": "themes/sakura-breeze.wmtheme.json",
      "sha256": "d860e4fe27eb603eb84b9f79c843c0b1be606795d2440475adb51b41a7015944",
      "sizeBytes": 61853,
      "previews": [
        "previews/sakura-breeze.jpg"
      ],
      "minAppVersion": 3,
      "license": "CC0-1.0",
      "requires": [
        "caveat",
        "marimba"
      ]
    },
    {
      "id": "synthwave-highway",
      "type": "theme",
      "name": "Synthwave Highway",
      "version": "1.1.0",
      "author": "Wasi Master",
      "description": "An animated sunset grid rolling behind slanted, translucent neon keys and a cyan glide trail. The background is a real looping GIF, and the key-preview bubble is a slanted neon key of its own, floating above the finger.",
      "tags": [
        "dark",
        "neon",
        "animated",
        "retro",
        "effects"
      ],
      "path": "themes/synthwave-highway.wmtheme.json",
      "sha256": "f1dffd7941bcf423dbe4f8d94a6218f72d3391ddaa5f15ac6ea2bdde90b4c6ed",
      "sizeBytes": 37464,
      "previews": [
        "previews/synthwave-highway.jpg"
      ],
      "minAppVersion": 3,
      "license": "CC0-1.0"
    },
    {
      "id": "blockland",
      "type": "theme",
      "name": "Blockland",
      "version": "1.3.0",
      "author": "Wasi Master",
      "description": "A blocky sandbox look: tiled dirt letter keys, stone modifiers, a grass enter and a plank space bar under a drifting pixel-cloud sky — a real looping GIF — with a thock key sound. The E key is cut from emerald, and the key popup is a dead-square plank block with a chunky rim. On a Bengali board the keys are cut from Pixelborno, a pixel face with the conjuncts intact.",
      "tags": [
        "blocks",
        "pixel",
        "light",
        "textures",
        "animated"
      ],
      "path": "themes/blockland.wmtheme.json",
      "sha256": "0228158bf4a6031fe1a28c23abcd373c034fe6b7bcba55da34fb4fea3cd0d70c",
      "sizeBytes": 89215,
      "previews": [
        "previews/blockland.jpg"
      ],
      "minAppVersion": 3,
      "license": "CC0-1.0",
      "requires": [
        "pixelborno"
      ]
    },
    {
      "id": "typewriter-noir",
      "type": "theme",
      "name": "Typewriter Noir",
      "version": "1.1.0",
      "author": "Wasi Master",
      "description": "Paper keys on a dark desk — round typewriter caps rimmed in metal — a red carriage-return enter, and grain in the paper. The key popup is a round cap too. Designed around the JetBrains Mono font and the Typewriter key sound.",
      "tags": [
        "dark",
        "retro",
        "mono",
        "paper"
      ],
      "path": "themes/typewriter-noir.wmtheme.json",
      "sha256": "e2f7e124351d0772a0d9f08a195662332283e7799433bc321059e31bc0613189",
      "sizeBytes": 5928,
      "previews": [
        "previews/typewriter-noir.jpg"
      ],
      "minAppVersion": 4,
      "license": "CC0-1.0",
      "requires": [
        "jetbrains-mono",
        "typewriter"
      ]
    },
    {
      "id": "deep-orbit",
      "type": "theme",
      "name": "Deep Orbit",
      "version": "1.0.0",
      "author": "Wasi Master",
      "description": "A nebula photo behind translucent pill keys, a ringed planet resting on the corner of the board, a galaxy strip across the space bar and star bursts under your fingers. Key popups float free above the keys like ringed bubbles. Designed around the Droplet key sound.",
      "tags": [
        "dark",
        "space",
        "stickers",
        "photo",
        "effects"
      ],
      "path": "themes/deep-orbit.wmtheme.json",
      "sha256": "d4e7daaa5fe2d3bd8b05e2c67c500f30867c897584c28288b58d1c6d33c7bfdd",
      "sizeBytes": 77264,
      "previews": [
        "previews/deep-orbit.jpg"
      ],
      "minAppVersion": 3,
      "license": "CC0-1.0",
      "requires": [
        "droplet"
      ]
    },
    {
      "id": "michil",
      "type": "theme",
      "name": "Michil",
      "version": "1.1.0",
      "author": "Wasi Master",
      "description": "The Michil community's dashboard as a keyboard, in its exact palette: parchment card keys edged in brown on the site's flat cream background, a deep-green quest-button enter outlined in light green, a gold Michilcoin on the M key, a warning-gold press flash, and coins, stars and trophies bursting from every press. Designed around the Bloxat font and the Blip key sound, with Pixelborno carrying the Bengali board.",
      "tags": [
        "pixel",
        "retro",
        "light",
        "green",
        "effects"
      ],
      "path": "themes/michil.wmtheme.json",
      "sha256": "02c34883ee79987f0301748560c4a2efd541375850e0bf78a1cef62f0097ceb8",
      "sizeBytes": 8939,
      "previews": [
        "previews/michil.jpg"
      ],
      "minAppVersion": 4,
      "license": "CC0-1.0",
      "requires": [
        "bloxat",
        "blip",
        "pixelborno"
      ]
    },
    {
      "id": "braille",
      "type": "layout",
      "name": "Braille (Unicode)",
      "version": "1.0.0",
      "author": "WM Keyboard",
      "description": "Types Unicode braille cells (⠁⠃⠉⠙) from QWERTY key positions, with the Latin letter on long-press and shown as the corner hint. Includes the capital and number signs. For writing braille as text — it is not a six-key chorded braille input.",
      "tags": [
        "braille",
        "accessibility",
        "unicode"
      ],
      "path": "layouts/braille.wmlayout.json",
      "sha256": "2f857c5863a412328b07f932462a0947720b89ddd4afc4322f1e18c4d81a0535",
      "sizeBytes": 7307,
      "previews": [
        "previews/braille-grid.jpg",
        "previews/braille.jpg"
      ],
      "langId": "en",
      "license": "CC0-1.0"
    },
    {
      "id": "en-developer",
      "type": "dictionary",
      "name": "Developer Dictionary",
      "version": "1.0.0",
      "author": "Wasi Master",
      "description": "An exhaustive developer dictionary containing top programming terms, syntax keywords, libraries, DevOps tools, databases, and methodologies.",
      "tags": [
        "developer",
        "english"
      ],
      "path": "dictionaries/en-developer.txt",
      "sha256": "353edbd2a56a205c9a3da12eebc15a113b4e0c65965493ee84c7e267a5df067d",
      "sizeBytes": 17126,
      "previews": [
        "previews/en-developer.png"
      ],
      "langId": "en",
      "license": "CC0-1.0"
    },
    {
      "id": "en-slang",
      "type": "dictionary",
      "name": "Internet Slang & Urban Dictionary",
      "version": "1.1.0",
      "author": "Wasi Master",
      "description": "An exhaustive internet slang dictionary covering Gen Z, Gen Alpha, brainrot, Twitch emotes, TikTok trends, AI tech slang, anime/K-Pop culture, gaming terminology, and Urban Dictionary acronyms.",
      "tags": [
        "slang",
        "genz",
        "genalpha",
        "brainrot",
        "twitch",
        "english"
      ],
      "path": "dictionaries/en-slang.txt",
      "sha256": "03b8cb2035c65d47b9e3af735529a271697eee4486b88f15bd0527572f71d8d3",
      "sizeBytes": 6572,
      "previews": [
        "previews/en-slang.png"
      ],
      "langId": "en",
      "license": "CC0-1.0"
    },
    {
      "id": "en-medical",
      "type": "dictionary",
      "name": "Medical & Clinical Dictionary",
      "version": "1.0.0",
      "author": "Wasi Master",
      "description": "An exhaustive medical and clinical dictionary covering drug generic and chemical compound names, brand pharmaceuticals, diseases, rare syndromes, surgical procedures, diagnostic equipment, and medical terminology.",
      "tags": [
        "medical",
        "clinical",
        "pharma",
        "medicine",
        "anatomy",
        "english"
      ],
      "path": "dictionaries/en-medical.txt",
      "sha256": "312455b44ad703cae5b983edb3ce77c99549773b3bff7ebf45fb235378165c92",
      "sizeBytes": 15426,
      "previews": [
        "previews/en-medical.png"
      ],
      "langId": "en",